{"$schema":"https://json-schema.org/draft/2020-12/schema","$id":"https://aura.example/schemas/events/payment-confirmed.v1.schema.json","title":"PaymentConfirmed","type":"object","required":["event_id","event_type","event_version","occurred_at","producer","aggregate_type","aggregate_id","correlation_id","payload"],"properties":{"event_id":{"type":"string"},"event_type":{"const":"PaymentConfirmed"},"event_version":{"const":1},"occurred_at":{"type":"string","format":"date-time"},"producer":{"const":"payments"},"aggregate_type":{"const":"payment"},"aggregate_id":{"type":"string"},"correlation_id":{"type":"string"},"causation_id":{"type":"string"},"payload":{"type":"object","required":["payment_id","order_id","amount_minor","currency"],"properties":{"payment_id":{"type":"string"},"order_id":{"type":"string"},"amount_minor":{"type":"integer","minimum":0},"currency":{"type":"string","minLength":3,"maxLength":3}},"additionalProperties":false}},"additionalProperties":false}