{
  "event_id": "evt_payment_confirmed_001",
  "event_type": "PaymentConfirmed",
  "event_version": 1,
  "occurred_at": "2026-08-10T11:00:00Z",
  "producer": "payments",
  "aggregate_type": "payment",
  "aggregate_id": "pay_001",
  "correlation_id": "req_001",
  "causation_id": "evt_payment_initiated_001",
  "payload": {
    "payment_id": "pay_001",
    "order_id": "ord_001",
    "amount_minor": 25000,
    "currency": "IQD"
  }
}
